{
  "captured_at": "2026-10-17T14:11:23Z",
  "containers": [
    "TMR1995/pt17a",
    "TMR1995/pt17a/div10"
  ],
  "content_hash": "sha256:776510ae3ce86ca2e69c8bc6aafa5eaa069f63d76143a88a3f9eedce16e3ddb2",
  "extractor_version": "legislation/0.3.0",
  "heading_path": [
    "Trade Marks Regulations 1995",
    "Part 17A—Protected international trade marks under the Madrid Protocol",
    "Division 10—Recording of claimed interests and rights",
    "17A.61  Application to have claims recorded"
  ],
  "instrument": "TMR1995",
  "kind": "regulation",
  "number": "17A.61",
  "ref": "TMR1995/r17A.61",
  "text": "(1) A person who claims an interest in, or a right in respect of, a trade mark that is the subject of an IRDA or is a protected international trade mark may apply to the Registrar to have particulars of the claim recorded by the Registrar. (2) An application by a person under subregulation (1) must: (a) be made in an approved form; and (b) be accompanied by material supporting the person’s interest in, or a right in respect of, the trade mark; and (b) be filed with the Trade Marks Office.",
  "title": "Application to have claims recorded",
  "units": [
    {
      "content_hash": "sha256:7eb64ce3fb5b8f60b2d648fdcb88bb22b162fae1fc6cccee78b557f2c9c482c3",
      "depth": 0,
      "kind": "subsection",
      "number": "(1)",
      "ordinal": 1,
      "parent_ref": null,
      "ref": "TMR1995/r17A.61(1)",
      "style": "subsection",
      "text": "(1) A person who claims an interest in, or a right in respect of, a trade mark that is the subject of an IRDA or is a protected international trade mark may apply to the Registrar to have particulars of the claim recorded by the Registrar."
    },
    {
      "content_hash": "sha256:0d6043ff2c4b40fe7a8e2c914d12602d4a49a26cb9ec150c1449beafbded3d85",
      "depth": 0,
      "kind": "subsection",
      "number": "(2)",
      "ordinal": 2,
      "parent_ref": null,
      "ref": "TMR1995/r17A.61(2)",
      "style": "subsection",
      "text": "(2) An application by a person under subregulation (1) must:"
    },
    {
      "content_hash": "sha256:9ecfc4126545c9f10d6f3efc6a7aa5f5ff5d138fa0d7e0eccae257043f37d5e1",
      "depth": 1,
      "kind": "paragraph",
      "number": "(a)",
      "ordinal": 3,
      "parent_ref": "TMR1995/r17A.61(2)",
      "ref": "TMR1995/r17A.61(2)(a)",
      "style": "paragraph",
      "text": "(a) be made in an approved form; and"
    },
    {
      "content_hash": "sha256:94328be68314dc924b4d8c0dacddf8fd5a9d82c020b725225844dcfe5549712e",
      "depth": 1,
      "kind": "paragraph",
      "number": "(b)",
      "number_collision": true,
      "ordinal": 4,
      "parent_ref": "TMR1995/r17A.61(2)",
      "ref": "TMR1995/r17A.61(2)(b)",
      "style": "paragraph",
      "text": "(b) be accompanied by material supporting the person’s interest in, or a right in respect of, the trade mark; and"
    },
    {
      "content_hash": "sha256:33ecbf0532d545e262bcbc26604e7f1dee416851ab63f2409637ffbd692c854c",
      "depth": 1,
      "kind": "paragraph",
      "number": "(b)",
      "number_collision": true,
      "ordinal": 5,
      "parent_ref": "TMR1995/r17A.61(2)",
      "ref": "TMR1995/r17A.61(2)(b)~2",
      "style": "paragraph",
      "text": "(b) be filed with the Trade Marks Office."
    }
  ]
}
