{
  "captured_at": "2026-10-17T14:11:23Z",
  "containers": [
    "TMA1995/pt7",
    "TMA1995/pt7/div3"
  ],
  "content_hash": "sha256:f5ae90abaea64b3b01cb5d496dfc3ce145a543d056c8ceeba01984ecd62168f9",
  "extractor_version": "legislation/0.3.0",
  "heading_path": [
    "Trade Marks Act 1995",
    "Part 7—Registration of trade marks",
    "Division 3—Renewal of registration (registration delayed for 10 or more years after filing date)",
    "80D  Request for renewal"
  ],
  "instrument": "TMA1995",
  "kind": "section",
  "number": "80D",
  "ref": "TMA1995/s80D",
  "text": "(1) Any person may, within the prescribed period, ask the Registrar to renew, or successively renew, the registration of the trade mark for one or more potential renewal periods nominated in the request. (2) The nomination must cover at least the first potential renewal period. (3) If the nomination relates to more than one potential renewal period, the nomination must cover continuous periods. (4) The request must: (a) be in an approved form; and (b) be filed in accordance with the regulations.",
  "title": "Request for renewal",
  "units": [
    {
      "content_hash": "sha256:1d98a152eade935d1a26fecd03f676df908fa2709eed8b1263d9200ba714335b",
      "depth": 0,
      "kind": "subsection",
      "number": "(1)",
      "ordinal": 1,
      "parent_ref": null,
      "ref": "TMA1995/s80D(1)",
      "style": "subsection",
      "text": "(1) Any person may, within the prescribed period, ask the Registrar to renew, or successively renew, the registration of the trade mark for one or more potential renewal periods nominated in the request."
    },
    {
      "content_hash": "sha256:4c5807aca975b2808162263a11897f7d5af5458477305de343b9b654874bf05e",
      "depth": 0,
      "kind": "subsection",
      "number": "(2)",
      "ordinal": 2,
      "parent_ref": null,
      "ref": "TMA1995/s80D(2)",
      "style": "subsection",
      "text": "(2) The nomination must cover at least the first potential renewal period."
    },
    {
      "content_hash": "sha256:d8cd3553198a1a0100a1292dce0394e7ccdb91b9c8a11cb4aaf4ddc4348a787a",
      "depth": 0,
      "kind": "subsection",
      "number": "(3)",
      "ordinal": 3,
      "parent_ref": null,
      "ref": "TMA1995/s80D(3)",
      "style": "subsection",
      "text": "(3) If the nomination relates to more than one potential renewal period, the nomination must cover continuous periods."
    },
    {
      "content_hash": "sha256:fc2e94f0e5d655d2107b28fa72473615cb7d9474844ee0bdfee6cc90e5ea4394",
      "depth": 0,
      "kind": "subsection",
      "number": "(4)",
      "ordinal": 4,
      "parent_ref": null,
      "ref": "TMA1995/s80D(4)",
      "style": "subsection",
      "text": "(4) The request must:"
    },
    {
      "content_hash": "sha256:58d123d84a6c348cac0c8d2dee2668a71cd5982f4d07446c2635ea84d71849b8",
      "depth": 1,
      "kind": "paragraph",
      "number": "(a)",
      "ordinal": 5,
      "parent_ref": "TMA1995/s80D(4)",
      "ref": "TMA1995/s80D(4)(a)",
      "style": "paragraph",
      "text": "(a) be in an approved form; and"
    },
    {
      "content_hash": "sha256:dd5163e130a77232a53515419d25f78cd6b491b6a93926496071dadc71f359ae",
      "depth": 1,
      "kind": "paragraph",
      "number": "(b)",
      "ordinal": 6,
      "parent_ref": "TMA1995/s80D(4)",
      "ref": "TMA1995/s80D(4)(b)",
      "style": "paragraph",
      "text": "(b) be filed in accordance with the regulations."
    }
  ]
}
