{
  "captured_at": "2026-10-17T14:11:23Z",
  "containers": [
    "TMR1995/pt5",
    "TMR1995/pt5/div5"
  ],
  "content_hash": "sha256:ae8a37cc1ae052143ebde48d3417434eb1a7e45ef223b0d3ed98120076dcc403",
  "extractor_version": "legislation/0.3.0",
  "heading_path": [
    "Trade Marks Regulations 1995",
    "Part 5—Opposition to registration",
    "Division 5—Miscellaneous",
    "5.18  Copy of earlier Convention application to be available to opponent"
  ],
  "instrument": "TMR1995",
  "kind": "regulation",
  "number": "5.18",
  "ref": "TMR1995/r5.18",
  "text": "(1) In opposition proceedings relating to an application in respect of which the applicant claims a right of priority, an opponent may request the Registrar for a copy of an earlier application to be made available. (2) On receiving the request, the Registrar must require the applicant to file: (a) a copy of the earlier application certified in the trade marks office (or its equivalent) of the Convention country in which it was filed; and (b) if the earlier application is not in English: (i) a translation of the earlier application into English; and (ii) a certificate of verification relating to the translation. (3) Subregulation (2) does not apply if the applicant has already filed the relevant documents. (4) The Registrar must give a copy of the documents to the opponent. (5) If the applicant is the successor in title to the person who made the earlier application, the Registrar may require the applicant to provide documentary evidence that is sufficient to establish the passing of title to the applicant.",
  "title": "Copy of earlier Convention application to be available to opponent",
  "units": [
    {
      "content_hash": "sha256:3feefd166abbd2247ecda8aa7396c81f55610f847b356342f04650966d13a117",
      "depth": 0,
      "kind": "subsection",
      "number": "(1)",
      "ordinal": 1,
      "parent_ref": null,
      "ref": "TMR1995/r5.18(1)",
      "style": "subsection",
      "text": "(1) In opposition proceedings relating to an application in respect of which the applicant claims a right of priority, an opponent may request the Registrar for a copy of an earlier application to be made available."
    },
    {
      "content_hash": "sha256:13f9bd3a65152d44db50612ab3a07e4c27068c099a6e2e7a37fa29e2ce55b1cc",
      "depth": 0,
      "kind": "subsection",
      "number": "(2)",
      "ordinal": 2,
      "parent_ref": null,
      "ref": "TMR1995/r5.18(2)",
      "style": "subsection",
      "text": "(2) On receiving the request, the Registrar must require the applicant to file:"
    },
    {
      "content_hash": "sha256:4a714c02edc66d5c4ca26dbdf2cc845ca1e3ea1e78cefee6a0bf999a55aba596",
      "depth": 1,
      "kind": "paragraph",
      "number": "(a)",
      "ordinal": 3,
      "parent_ref": "TMR1995/r5.18(2)",
      "ref": "TMR1995/r5.18(2)(a)",
      "style": "paragraph",
      "text": "(a) a copy of the earlier application certified in the trade marks office (or its equivalent) of the Convention country in which it was filed; and"
    },
    {
      "content_hash": "sha256:b74dbb6f6367a3f7cc6b54f452e611226ba776c5e4fcf14911949f5f62bd1a0c",
      "depth": 1,
      "kind": "paragraph",
      "number": "(b)",
      "ordinal": 4,
      "parent_ref": "TMR1995/r5.18(2)",
      "ref": "TMR1995/r5.18(2)(b)",
      "style": "paragraph",
      "text": "(b) if the earlier application is not in English:"
    },
    {
      "content_hash": "sha256:4ee9cbccaa2a5119aec45c25d2817ad7b6eb300cad5c82d3cea9978d9ed3c476",
      "depth": 2,
      "kind": "paragraph",
      "number": "(i)",
      "ordinal": 5,
      "parent_ref": "TMR1995/r5.18(2)(b)",
      "ref": "TMR1995/r5.18(2)(b)(i)",
      "style": "paragraphsub",
      "text": "(i) a translation of the earlier application into English; and"
    },
    {
      "content_hash": "sha256:f3376dd6c5cd49b81655406fef6b2fd308ee13ab2fab869526ce80a63ad4bd3b",
      "depth": 2,
      "kind": "paragraph",
      "number": "(ii)",
      "ordinal": 6,
      "parent_ref": "TMR1995/r5.18(2)(b)",
      "ref": "TMR1995/r5.18(2)(b)(ii)",
      "style": "paragraphsub",
      "text": "(ii) a certificate of verification relating to the translation."
    },
    {
      "content_hash": "sha256:77710708eba756dd421b5bb90eaaba4ef035b859dc1dad267a94c044c8bf2e8f",
      "depth": 0,
      "kind": "subsection",
      "number": "(3)",
      "ordinal": 7,
      "parent_ref": null,
      "ref": "TMR1995/r5.18(3)",
      "style": "subsection",
      "text": "(3) Subregulation (2) does not apply if the applicant has already filed the relevant documents."
    },
    {
      "content_hash": "sha256:e6c3f21996cc8f161526729bb62242fbe62b8a44aa0ff7d08dc52fb02e5363b8",
      "depth": 0,
      "kind": "subsection",
      "number": "(4)",
      "ordinal": 8,
      "parent_ref": null,
      "ref": "TMR1995/r5.18(4)",
      "style": "subsection",
      "text": "(4) The Registrar must give a copy of the documents to the opponent."
    },
    {
      "content_hash": "sha256:cd8dc6193f6a4d8270bdace2a917919045c19976c50bd0985bdbe6a622913066",
      "depth": 0,
      "kind": "subsection",
      "number": "(5)",
      "ordinal": 9,
      "parent_ref": null,
      "ref": "TMR1995/r5.18(5)",
      "style": "subsection",
      "text": "(5) If the applicant is the successor in title to the person who made the earlier application, the Registrar may require the applicant to provide documentary evidence that is sufficient to establish the passing of title to the applicant."
    }
  ]
}
